id,title,published,num_authors,categories,summary
1506.06630v2,"Comment on ""Measuring propagation speed of Coulomb fields"" [R. de Sangro {\it et al.} Eur. Phys. J.C (2015) 75:137]",2015-06-12,1,physics.gen-ph,Some remarks are made on the theoretical interpretation of recent experimental results on the propagation speed of electromagnetic force fields.
2510.05278v2,Decoding Partial Differential Equations: Cross-Modal Adaptation of Decoder-only Models to PDEs,2025-10-06,4,cs.LG;cs.CL,"While large language models are primarily used on natural language tasks, they have also shown great promise when adapted to new modalities, e.g., for scientific machine learning tasks. Most proposed approaches for such cross-modal adaptation of language models focus on encoder-only transformer mode"
2004.10883v1,Constrained Neural Ordinary Differential Equations with Stability Guarantees,2020-04-22,3,eess.SY;cs.LG;cs.NE,"Differential equations are frequently used in engineering domains, such as modeling and control of industrial systems, where safety and performance guarantees are of paramount importance. Traditional physics-based modeling approaches require domain expertise and are often difficult to tune or adapt "
1712.05067v1,Neural networks catching up with finite differences in solving partial differential equations in higher dimensions,2017-12-14,1,cs.NE,"Fully connected multilayer perceptrons are used for obtaining numerical solutions of partial differential equations in various dimensions. Independent variables are fed into the input layer, and the output is considered as solution's value. To train such a network one can use square of equation's re"
1504.07523v6,Power spectrum and diffusion of the Amari neural field,2015-04-28,1,q-bio.NC;nlin.PS,"We study the power spectrum of a space-time dependent neural field which describes the average membrane potential of neurons in a single layer. This neural field is modelled by a dissipative integro-differential equation, the so-called Amari equation. By considering a small perturbation with respect"
1210.5831v1,Stability of a critical nonlinear neutral delay differential equation,2012-10-22,2,math.CA,"This work deals with a scalar nonlinear neutral delay differential equation issued from the study of wave propagation. A critical value of the coefficients is considered, where only few results are known. The difficulty follows from the fact that the spectrum of the linear operator is asymptotically"
2306.16524v2,Hyena Neural Operator for Partial Differential Equations,2023-06-28,3,cs.LG;cs.AI;math.NA,"Numerically solving partial differential equations typically requires fine discretization to resolve necessary spatiotemporal scales, which can be computationally expensive. Recent advances in deep learning have provided a new approach to solving partial differential equations that involves the use "
1708.07469v5,DGM: A deep learning algorithm for solving partial differential equations,2017-08-24,2,q-fin.MF;math.NA;q-fin.CP;stat.ML,"High-dimensional PDEs have been a longstanding computational challenge. We propose to solve high-dimensional PDEs by approximating the solution with a deep neural network which is trained to satisfy the differential operator, initial condition, and boundary conditions. Our algorithm is meshfree, whi"
2506.16000v1,Quantum Artificial Intelligence for Secure Autonomous Vehicle Navigation: An Architectural Proposal,2025-06-19,2,cs.ET;cs.AI;cs.RO;quant-ph,"Navigation is a very crucial aspect of autonomous vehicle ecosystem which heavily relies on collecting and processing large amounts of data in various states and taking a confident and safe decision to define the next vehicle maneuver. In this paper, we propose a novel architecture based on Quantum "
2309.01461v1,Joint vehicle state and parameters estimation via Twin-in-the-Loop observers,2023-09-04,3,eess.SY,"Vehicular control systems are required to be both extremely reliable and robust to different environmental conditions, e.g. load or tire-road friction. In this paper, we extend a new paradigm for state estimation, called Twin-in-the-Loop filtering (TiL-F), to the estimation of the unknown parameters"
2506.10461v1,Automating Multi-Tenancy Performance Evaluation on Edge Compute Nodes,2025-06-12,4,cs.DC,"Edge Computing emerges as a promising alternative of Cloud Computing, with scalable compute resources and services deployed in the path between IoT devices and Cloud. Since virtualization techniques can be applied on Edge compute nodes, administrators can share their Edge infrastructures among multi"
1411.3958v3,Edge-state enhanced transport in a 2-dimensional quantum walk,2014-11-14,2,cond-mat.mes-hall;quant-ph,"Quantum walks on translation invariant regular graphs spread quadratically faster than their classical counterparts. The same coherence that gives them this quantum speedup inhibits, or even stops their spread in the presence of disorder. We ask how to create an efficient transport channel from a fi"
2007.04193v2,Mobility driven Cloud-Fog-Edge Framework for Location-aware Services: A Comprehensive Review,2020-07-05,2,cs.DC;cs.NI;eess.SP,"With the pervasiveness of IoT devices, smart-phones and improvement of location-tracking technologies huge volume of heterogeneous geo-tagged (location specific) data is generated which facilitates several location-aware services. The analytics with this spatio-temporal (having location and time dim"
1705.08449v4,Developing an edge computing platform for real-time descriptive analytics,2017-05-23,3,cs.CY;cs.DC;cs.NI,"The Internet of Mobile Things encompasses stream data being generated by sensors, network communications that pull and push these data streams, as well as running processing and analytics that can effectively leverage actionable information for transportation planning, management, and business advan"
1909.06459v1,F-Cooper: Feature based Cooperative Perception for Autonomous Vehicle Edge Computing System Using 3D Point Clouds,2019-09-13,1,cs.CV,"Autonomous vehicles are heavily reliant upon their sensors to perfect the perception of surrounding environments, however, with the current state of technology, the data which a vehicle uses is confined to that from its own sensors. Data sharing between vehicles and/or edge servers is limited by the"
2007.01156v1,Enhancing Autonomy with Blockchain and Multi-Access Edge Computing in Distributed Robotic Systems,2020-07-01,4,cs.DC;eess.SP,This conceptual paper discusses how different aspects involving the autonomous operation of robots and vehicles will change when they have access to next-generation mobile networks. 5G and beyond connectivity is bringing together a myriad of technologies and industries under its umbrella. High-bandw
1706.06535v1,Combining edge and cloud computing for mobility analytics,2017-06-20,4,cs.DC;cs.CY;cs.NI,Mobility analytics using data generated from the Internet of Mobile Things (IoMT) is facing many challenges which range from the ingestion of data streams coming from a vast number of fog nodes and IoMT devices to avoiding overflowing the cloud with useless massive data streams that can trigger bott
1801.05610v3,A Taxonomy for Management and Optimization of Multiple Resources in Edge Computing,2018-01-17,2,cs.DC,"Edge computing is promoted to meet increasing performance needs of data-driven services using computational and storage resources close to the end devices, at the edge of the current network. To achieve higher performance in this new paradigm one has to consider how to combine the efficiency of reso"
2009.00041v1,Design and Simulation of a Hybrid Architecture for Edge Computing in 5G and Beyond,2020-08-31,6,cs.DC;eess.SP,"Edge Computing in 5G and Beyond is a promising solution for ultra-low latency applications (e.g. Autonomous Vehicle, Augmented Reality, and Remote Surgery), which have an extraordinarily low tolerance for the delay and require fast data processing for a very high volume of data. The requirements of "
2210.07842v1,ENTS: An Edge-native Task Scheduling System for Collaborative Edge Computing,2022-10-14,6,cs.NI;cs.DC,"Collaborative edge computing (CEC) is an emerging paradigm enabling sharing of the coupled data, computation, and networking resources among heterogeneous geo-distributed edge nodes. Recently, there has been a trend to orchestrate and schedule containerized application workloads in CEC, while Kubern"
2512.09309v1,A Distributed Framework for Privacy-Enhanced Vision Transformers on the Edge,2025-12-10,5,cs.DC;cs.CR;cs.CV,"Nowadays, visual intelligence tools have become ubiquitous, offering all kinds of convenience and possibilities. However, these tools have high computational requirements that exceed the capabilities of resource-constrained mobile and wearable devices. While offloading visual data to the cloud is a "
2506.06474v1,Edge-Enabled Collaborative Object Detection for Real-Time Multi-Vehicle Perception,2025-06-06,3,cs.RO;cs.AI;cs.CV;cs.MA;cs.NI,"Accurate and reliable object detection is critical for ensuring the safety and efficiency of Connected Autonomous Vehicles (CAVs). Traditional on-board perception systems have limited accuracy due to occlusions and blind spots, while cloud-based solutions introduce significant latency, making them u"
2001.09070v1,Priority-based Fair Scheduling in Edge Computing,2020-01-24,5,cs.DC;cs.NI,"Scheduling is important in Edge computing. In contrast to the Cloud, Edge resources are hardware limited and cannot support workload-driven infrastructure scaling. Hence, resource allocation and scheduling for the Edge requires a fresh perspective. Existing Edge scheduling research assumes availabil"
2407.08462v2,Distributed Deep Reinforcement Learning Based Gradient Quantization for Federated Learning Enabled Vehicle Edge Computing,2024-07-11,7,cs.LG;cs.NI,Federated Learning (FL) can protect the privacy of the vehicles in vehicle edge computing (VEC) to a certain extent through sharing the gradients of vehicles' local models instead of local data. The gradients of vehicles' local models are usually large for the vehicular artificial intelligence (AI) 
1905.10083v1,Edge Intelligence: Paving the Last Mile of Artificial Intelligence with Edge Computing,2019-05-24,6,cs.DC;cs.AI;cs.NI,"With the breakthroughs in deep learning, the recent years have witnessed a booming of artificial intelligence (AI) applications and services, spanning from personal assistant to recommendation systems to video/audio surveillance. More recently, with the proliferation of mobile computing and Internet"
2112.14706v2,Intersection focused Situation Coverage-based Verification and Validation Framework for Autonomous Vehicles Implemented in CARLA,2021-12-24,2,cs.RO;cs.AI;cs.MA;cs.SE,"Autonomous Vehicles (AVs) i.e., self-driving cars, operate in a safety critical domain, since errors in the autonomous driving software can lead to huge losses. Statistically, road intersections which are a part of the AVs operational design domain (ODD), have some of the highest accident rates. Hen"
2512.09378v2,Personalized Federated Distillation Assisted Vehicle Edge Caching Strategy,2025-12-10,6,cs.LG,Vehicle edge caching is a promising technology that can significantly reduce the latency for vehicle users (VUs) to access content by pre-caching user-interested content at edge nodes. It is crucial to accurately predict the content that VUs are interested in without exposing their privacy. Traditio
2201.05872v2,QoS-Aware Resource Placement for LEO Satellite Edge Computing,2022-01-15,2,cs.DC;cs.NI,"With the advent of large LEO satellite communication networks to provide global broadband Internet access, interest in providing edge computing resources within LEO networks has emerged. The LEO Edge promises low-latency, high-bandwidth access to compute and storage resources for a global base of cl"
2102.13477v2,B-ETS: A Trusted Blockchain-based Emissions Trading System for Vehicle-to-Vehicle Networks,2021-02-18,5,cs.MA;eess.SY,"Urban areas are negatively impacted by Carbon Dioxide (CO2 ) and Nitrogen Oxide (NOx) emissions. In order to achieve a cost-effective reduction of greenhouse gas emissions and to combat climate change, the European Union (EU) introduced an Emissions Trading System (ETS) where organizations can buy o"
2111.06318v2,Multi-agent Reinforcement Learning for Cooperative Lane Changing of Connected and Autonomous Vehicles in Mixed Traffic,2021-11-11,6,cs.LG;cs.MA,"Autonomous driving has attracted significant research interests in the past two decades as it offers many potential benefits, including releasing drivers from exhausting driving and mitigating traffic congestion, among others. Despite promising progress, lane-changing remains a great challenge for a"
2012.14713v1,Edge Computing Enabled by Unmanned Autonomous Vehicles,2020-12-29,4,cs.DC,"Pervasive applications are revolutionizing the perception that users have towards the environment. Indeed, pervasive applications perform resource intensive computations over large amounts of stream sensor data collected from multiple sources. This allows applications to provide richer and deep insi"
2105.01803v1,DeepRT: A Soft Real Time Scheduler for Computer Vision Applications on the Edge,2021-05-05,4,cs.DC;cs.CV,"The ubiquity of smartphone cameras and IoT cameras, together with the recent boom of deep learning and deep neural networks, proliferate various computer vision driven mobile and IoT applications deployed on the edge. This paper focuses on applications which make soft real time requests to perform i"
2311.09093v4,"Why Autonomous Vehicles Are Not Ready Yet: A Multi-Disciplinary Review of Problems, Attempted Solutions, and Future Directions",2023-11-15,13,cs.CV;cs.RO,"Personal autonomous vehicles are cars, trucks and bikes capable of sensing their surrounding environment, planning their route, and driving with little or no involvement of human drivers. Despite the impressive technological achievements made by the industry in recent times and the hopeful announcem"
1909.11058v1,Process migration-based computational offloading framework for IoT-supported mobile edge/cloud computing,2019-09-24,5,cs.DC;cs.NI,"Mobile devices have become an indispensable component of Internet of Things (IoT). However, these devices have resource constraints in processing capabilities, battery power, and storage space, thus hindering the execution of computation-intensive applications that often require broad bandwidth, str"
2310.05041v3,An Anomaly Behavior Analysis Framework for Securing Autonomous Vehicle Perception,2023-10-08,2,cs.RO;eess.SY,"As a rapidly growing cyber-physical platform, Autonomous Vehicles (AVs) are encountering more security challenges as their capabilities continue to expand. In recent years, adversaries are actively targeting the perception sensors of autonomous vehicles with sophisticated attacks that are not easily"
1808.05443v1,Transfer Learning and Organic Computing for Autonomous Vehicles,2018-08-16,1,cs.LG;cs.RO;stat.ML,Autonomous Vehicles(AV) are one of the brightest promises of the future which would help cut down fatalities and improve travel time while working in harmony. Autonomous vehicles will face with challenging situations and experiences not seen before. These experiences should be converted to knowledge
2405.16487v1,Dynamics Models in the Aggressive Off-Road Driving Regime,2024-05-26,6,cs.RO,"Current developments in autonomous off-road driving are steadily increasing performance through higher speeds and more challenging, unstructured environments. However, this operating regime subjects the vehicle to larger inertial effects, where consideration of higher-order states is necessary to av"
2604.21841v1,Cross-Modal Phantom: Coordinated Camera-LiDAR Spoofing Against Multi-Sensor Fusion in Autonomous Vehicles,2026-04-23,2,cs.CR,"Autonomous Vehicles (AVs) increasingly depend on Multi-Sensor Fusion (MSF) to combine complementary modalities such as cameras and LiDAR for robust perception. While this redundancy is intended to safeguard against single-sensor failures, the fusion process itself introduces a subtle and underexplor"
2406.18138v1,B-TMS: Bayesian Traversable Terrain Modeling and Segmentation Across 3D LiDAR Scans and Maps for Enhanced Off-Road Navigation,2024-06-26,10,cs.RO,"Recognizing traversable terrain from 3D point cloud data is critical, as it directly impacts the performance of autonomous navigation in off-road environments. However, existing segmentation algorithms often struggle with challenges related to changes in data distribution, environmental specificity,"
2312.14919v3,Lift-Attend-Splat: Bird's-eye-view camera-lidar fusion using transformers,2023-12-22,7,cs.CV;cs.LG,Combining complementary sensor modalities is crucial to providing robust perception for safety-critical robotics applications such as autonomous driving (AD). Recent state-of-the-art camera-lidar fusion methods for AD rely on monocular depth estimation which is a notoriously difficult task compared 
2405.13318v1,BenchNav: Simulation Platform for Benchmarking Off-road Navigation Algorithms with Probabilistic Traversability,2024-05-22,3,cs.RO,"As robotic navigation techniques in perception and planning advance, mobile robots increasingly venture into off-road environments involving complex traversability. However, selecting suitable planning methods remains a challenge due to their algorithmic diversity, as each offers unique benefits. To"
2307.00741v1,"UnLoc: A Universal Localization Method for Autonomous Vehicles using LiDAR, Radar and/or Camera Input",2023-07-03,4,cs.RO;cs.AI;cs.CV;cs.LG,Localization is a fundamental task in robotics for autonomous navigation. Existing localization methods rely on a single input data modality or train several computational models to process different modalities. This leads to stringent computational requirements and sub-optimal results that fail to 
2403.02642v1,UFO: Uncertainty-aware LiDAR-image Fusion for Off-road Semantic Terrain Map Estimation,2024-03-05,4,cs.RO;cs.CV,"Autonomous off-road navigation requires an accurate semantic understanding of the environment, often converted into a bird's-eye view (BEV) representation for various downstream tasks. While learning-based methods have shown success in generating local semantic terrain maps directly from sensor data"
2310.02532v1,ShaSTA-Fuse: Camera-LiDAR Sensor Fusion to Model Shape and Spatio-Temporal Affinities for 3D Multi-Object Tracking,2023-10-04,3,cs.CV,"3D multi-object tracking (MOT) is essential for an autonomous mobile agent to safely navigate a scene. In order to maximize the perception capabilities of the autonomous agent, we aim to develop a 3D MOT framework that fuses camera and LiDAR sensor information. Building on our prior LiDAR-only work,"
2007.05490v1,Camera-Lidar Integration: Probabilistic sensor fusion for semantic mapping,2020-07-09,4,cs.CV;cs.RO,"An automated vehicle operating in an urban environment must be able to perceive and recognise object/obstacles in a three-dimensional world while navigating in a constantly changing environment. In order to plan and execute accurate sophisticated driving maneuvers, a high-level contextual understand"
1701.04694v1,Sequential Fusion Estimation for Clustered Sensor Networks,2017-01-14,2,math.OC,"We consider multi-sensor fusion estimation for clustered sensor networks. Both sequential measurement fusion and state fusion estimation methods are presented. It is shown that the proposed sequential fusion estimation methods achieve the same performance as the batch fusion one, but are more conven"
2204.11202v1,2D LiDAR and Camera Fusion Using Motion Cues for Indoor Layout Estimation,2022-04-24,2,cs.CV,"This paper presents a novel indoor layout estimation system based on the fusion of 2D LiDAR and intensity camera data. A ground robot explores an indoor space with a single floor and vertical walls, and collects a sequence of intensity images and 2D LiDAR datasets. The LiDAR provides accurate depth "
2302.04024v1,InMyFace: Inertial and Mechanomyography-Based Sensor Fusion for Wearable Facial Activity Recognition,2023-02-08,5,cs.LG;eess.SP,"Recognizing facial activity is a well-understood (but non-trivial) computer vision problem. However, reliable solutions require a camera with a good view of the face, which is often unavailable in wearable settings. Furthermore, in wearable applications, where systems accompany users throughout thei"
2307.10519v1,Probabilistic Multimodal Depth Estimation Based on Camera-LiDAR Sensor Fusion,2023-07-20,3,cs.RO,"Multi-modal depth estimation is one of the key challenges for endowing autonomous machines with robust robotic perception capabilities. There have been outstanding advances in the development of uni-modal depth estimation techniques based on either monocular cameras, because of their rich resolution"
1909.04102v2,LIC-Fusion: LiDAR-Inertial-Camera Odometry,2019-09-09,5,cs.RO,"This paper presents a tightly-coupled multi-sensor fusion algorithm termed LiDAR-inertial-camera fusion (LIC-Fusion), which efficiently fuses IMU measurements, sparse visual features, and extracted LiDAR points. In particular, the proposed LIC-Fusion performs online spatial and temporal sensor calib"
2110.01440v4,Arithmetic Average Density Fusion -- Part I: Some Statistic and Information-theoretic Results,2021-10-01,4,math.ST;cs.IT,Finite mixture such as the Gaussian mixture is a flexible and powerful probabilistic modeling tool for representing the multimodal distribution widely involved in many estimation and learning problems. The core of it is representing the target distribution by the arithmetic average (AA) of a finite 
2106.09249v1,Invisible for both Camera and LiDAR: Security of Multi-Sensor Fusion based Perception in Autonomous Driving Under Physical-World Attacks,2021-06-17,9,cs.CR;cs.CV;cs.LG,"In Autonomous Driving (AD) systems, perception is both security and safety critical. Despite various prior studies on its security issues, all of them only consider attacks on camera- or LiDAR-based AD perception alone. However, production AD systems today predominantly adopt a Multi-Sensor Fusion ("
2311.03198v2,LCPR: A Multi-Scale Attention-Based LiDAR-Camera Fusion Network for Place Recognition,2023-11-06,4,cs.CV;cs.RO,"Place recognition is one of the most crucial modules for autonomous vehicles to identify places that were previously visited in GPS-invalid environments. Sensor fusion is considered an effective method to overcome the weaknesses of individual sensors. In recent years, multimodal place recognition fu"
2106.07098v4,Security Analysis of Camera-LiDAR Fusion Against Black-Box Attacks on Autonomous Vehicles,2021-06-13,5,cs.CR;cs.LG;eess.SY,"To enable safe and reliable decision-making, autonomous vehicles (AVs) feed sensor data to perception algorithms to understand the environment. Sensor fusion with multi-frame tracking is becoming increasingly popular for detecting 3D objects. Thus, in this work, we perform an analysis of camera-LiDA"
2508.05264v6,SGDFuse: SAM-Guided Diffusion Model for High-Fidelity Infrared and Visible Image Fusion,2025-08-07,7,cs.CV;cs.AI,"Infrared and visible image fusion (IVIF) is essential for integrating thermal saliency with textural details to support downstream perception. However, most existing approaches suffer from ""semantic blindness,"" leading to the erroneous suppression of thermal targets and the introduction of visual ar"
2310.06008v1,CoBEVFusion: Cooperative Perception with LiDAR-Camera Bird's-Eye View Fusion,2023-10-09,2,cs.CV,"Autonomous Vehicles (AVs) use multiple sensors to gather information about their surroundings. By sharing sensor data between Connected Autonomous Vehicles (CAVs), the safety and reliability of these vehicles can be improved through a concept known as cooperative perception. However, recent approach"
2401.01439v1,Off-Road LiDAR Intensity Based Semantic Segmentation,2024-01-02,4,cs.CV;cs.RO,"LiDAR is used in autonomous driving to provide 3D spatial information and enable accurate perception in off-road environments, aiding in obstacle detection, mapping, and path planning. Learning-based LiDAR semantic segmentation utilizes machine learning techniques to automatically classify objects a"
2409.12034v2,Multi-Sensor Deep Learning for Glacier Mapping,2024-09-18,4,cs.CV;eess.IV,"The more than 200,000 glaciers outside the ice sheets play a crucial role in our society by influencing sea-level rise, water resource management, natural hazards, biodiversity, and tourism. However, only a fraction of these glaciers benefit from consistent and detailed in-situ observations that all"
2308.14414v1,INF: Implicit Neural Fusion for LiDAR and Camera,2023-08-28,6,cs.CV,"Sensor fusion has become a popular topic in robotics. However, conventional fusion methods encounter many difficulties, such as data representation differences, sensor variations, and extrinsic calibration. For example, the calibration methods used for LiDAR-camera fusion often require manual operat"
2108.07511v1,LIF-Seg: LiDAR and Camera Image Fusion for 3D LiDAR Semantic Segmentation,2021-08-17,6,cs.CV,"Camera and 3D LiDAR sensors have become indispensable devices in modern autonomous driving vehicles, where the camera provides the fine-grained texture, color information in 2D space and LiDAR captures more precise and farther-away distance measurements of the surrounding environments. The complemen"
2603.25777v2,Challenges and opportunities for AI to help deliver fusion energy,2026-03-26,8,physics.plasm-ph;cs.AI,"There is great potential for the application of AI tools in fusion research, and substantial worldwide benefit if fusion power is realised. However, using AI comes with its own challenges, many of which can be mitigated if responsible and robust methodologies are built into existing approaches. To d"
