id,title,published,num_authors,categories,summary
2603.09529v2,RESBev: Making BEV Perception More Robust,2026-03-10,4,cs.CV,"Bird's-eye-view (BEV) perception has emerged as a cornerstone of autonomous driving systems, providing a structured, ego-centric representation critical for downstream planning and control. However, real-world deployment faces challenges from sensor degradation and adversarial attacks, which can cau"
2303.03583v2,Calibration-free BEV Representation for Infrastructure Perception,2023-03-07,5,cs.CV,"Effective BEV object detection on infrastructure can greatly improve traffic scenes understanding and vehicle-toinfrastructure (V2I) cooperative perception. However, cameras installed on infrastructure have various postures, and previous BEV detection methods rely on accurate calibration, which is d"
2411.10639v2,MTA: Multimodal Task Alignment for BEV Perception and Captioning,2024-11-16,8,cs.CV;cs.AI;cs.CL;cs.LG,"Bird's eye view (BEV)-based 3D perception plays a crucial role in autonomous driving applications. The rise of large language models has spurred interest in BEV-based captioning to understand object behavior in the surrounding environment. However, existing approaches treat perception and captioning"
2312.11578v1,Diffusion-Based Particle-DETR for BEV Perception,2023-12-18,4,cs.CV,"The Bird-Eye-View (BEV) is one of the most widely-used scene representations for visual perception in Autonomous Vehicles (AVs) due to its well suited compatibility to downstream tasks. For the enhanced safety of AVs, modeling perception uncertainty in BEV is crucial. Recent diffusion-based methods "
2401.08687v2,DA-BEV: Unsupervised Domain Adaptation for Bird's Eye View Perception,2024-01-13,6,cs.CV,"Camera-only Bird's Eye View (BEV) has demonstrated great potential in environment perception in a 3D space. However, most existing studies were conducted under a supervised setup which cannot scale well while handling various new data. Unsupervised domain adaptive BEV, which effective learning from "
2602.13555v1,Privacy-Concealing Cooperative Perception for BEV Scene Segmentation,2026-02-14,4,cs.CV;cs.AI,"Cooperative perception systems for autonomous driving aim to overcome the limited perception range of a single vehicle by communicating with adjacent agents to share sensing information. While this improves perception performance, these systems also face a significant privacy-leakage issue, as sensi"
2301.12511v2,Fast-BEV: A Fast and Strong Bird's-Eye View Perception Baseline,2023-01-29,11,cs.CV,"Recently, perception task based on Bird's-Eye View (BEV) representation has drawn more and more attention, and BEV representation is promising as the foundation for next-generation Autonomous Vehicle (AV) perception. However, most existing BEV solutions either require considerable resources to execu"
2508.21738v2,From Drone Imagery to Livability Mapping: AI-powered Environment Perception in Rural China,2025-08-29,6,cs.CY;cs.CV,"The high cost of acquiring rural street view images has constrained comprehensive environmental perception in rural areas. Drone photographs, with their advantages of easy acquisition, broad coverage, and high spatial resolution, offer a viable approach for large-scale rural environmental perception"
1904.06299v1,Effects of Demand Variation on Optimal Automated Demand Responsive Feeder Transit System Operation in Rural Areas,2019-04-09,3,physics.soc-ph;math.OC,"Improving accessibility is one of the major issues in rural and suburban transportation. With the recent technological improvement of automated vehicles, it is expected that automated demand responsive transit and automated demand responsive feeder transit potentially will be options to improve mobi"
2407.12491v2,Hierarchical and Decoupled BEV Perception Learning Framework for Autonomous Driving,2024-07-17,7,cs.CV,"Perception is essential for autonomous driving system. Recent approaches based on Bird's-eye-view (BEV) and deep learning have made significant progress. However, there exists challenging issues including lengthy development cycles, poor reusability, and complex sensor setups in perception algorithm"
2301.07870v1,Fast-BEV: Towards Real-time On-vehicle Bird's-Eye View Perception,2023-01-19,10,cs.CV,"Recently, the pure camera-based Bird's-Eye-View (BEV) perception removes expensive Lidar sensors, making it a feasible solution for economical autonomous driving. However, most existing BEV solutions either suffer from modest performance or require considerable resources to execute on-vehicle infere"
2306.00349v2,CALICO: Self-Supervised Camera-LiDAR Contrastive Pre-training for BEV Perception,2023-06-01,6,cs.CV;cs.LG,"Perception is crucial in the realm of autonomous driving systems, where bird's eye view (BEV)-based architectures have recently reached state-of-the-art performance. The desirability of self-supervised representation learning stems from the expensive and laborious process of annotating 2D and 3D dat"
2504.01957v2,Toward Real-world BEV Perception: Depth Uncertainty Estimation via Gaussian Splatting,2025-04-02,3,cs.CV,"Bird's-eye view (BEV) perception has gained significant attention because it provides a unified representation to fuse multiple view images and enables a wide range of down-stream autonomous driving tasks, such as forecasting and planning. Recent state-of-the-art models utilize projection-based meth"
2407.14108v2,GaussianBeV: 3D Gaussian Representation meets Perception Models for BeV Segmentation,2024-07-19,3,cs.CV,"The Bird's-eye View (BeV) representation is widely used for 3D perception from multi-view camera images. It allows to merge features from different cameras into a common space, providing a unified representation of the 3D scene. The key component is the view transformer, which transforms image views"
2211.10593v1,MatrixVT: Efficient Multi-Camera to BEV Transformation for 3D Perception,2022-11-19,4,cs.CV,"This paper proposes an efficient multi-camera to Bird's-Eye-View (BEV) view transformation method for 3D perception, dubbed MatrixVT. Existing view transformers either suffer from poor transformation efficiency or rely on device-specific operators, hindering the broad application of BEV models. In c"
2411.06173v2,LSSInst: Improving Geometric Modeling in LSS-Based BEV Perception with Instance Representation,2024-11-09,5,cs.CV,"With the attention gained by camera-only 3D object detection in autonomous driving, methods based on Bird-Eye-View (BEV) representation especially derived from the forward view transformation paradigm, i.e., lift-splat-shoot (LSS), have recently seen significant progress. The BEV representation form"
2206.07959v2,Simple-BEV: What Really Matters for Multi-Sensor BEV Perception?,2022-06-16,5,cs.CV,"Building 3D perception systems for autonomous vehicles that do not rely on high-density LiDAR is a critical research problem because of the expense of LiDAR systems compared to cameras and other sensors. Recent research has developed a variety of camera-only methods, where features are differentiabl"
2301.09957v1,Real-Time HAP-Assisted Vehicular Edge Computing for Rural Areas,2023-01-24,4,cs.NI;cs.IT;eess.SP,"Non-Terrestrial Networks (NTNs) are expected to be a key component of 6th generation (6G) networks to support broadband seamless Internet connectivity and expand the coverage even in rural and remote areas. In this context, High Altitude Platforms (HAPs) can act as edge servers to process computatio"
2605.30983v1,Can BEV Perception Gracefully Degrade under Sensor Failures?,2026-05-29,5,cs.CV,"Despite the remarkable success of multi-modal bird's-eye view (BEV) perception in autonomous driving, current systems exhibit a critical vulnerability: existing fusion mechanisms are highly brittle to sensor corruptions, often causing catastrophic performance degradation. This vulnerability largely "
2409.02676v1,Improved Single Camera BEV Perception Using Multi-Camera Training,2024-09-04,4,cs.CV,"Bird's Eye View (BEV) map prediction is essential for downstream autonomous driving tasks like trajectory prediction. In the past, this was accomplished through the use of a sophisticated sensor configuration that captured a surround view from multiple cameras. However, in large-scale production, co"
2410.12394v1,Real-time Stereo-based 3D Object Detection for Streaming Perception,2024-10-16,6,cs.CV,"The ability to promptly respond to environmental changes is crucial for the perception system of autonomous driving. Recently, a new task called streaming perception was proposed. It jointly evaluate the latency and accuracy into a single metric for video online perception. In this work, we introduc"
2409.17659v1,Hierarchical End-to-End Autonomous Driving: Integrating BEV Perception with Deep Reinforcement Learning,2024-09-26,6,cs.AI,"End-to-end autonomous driving offers a streamlined alternative to the traditional modular pipeline, integrating perception, prediction, and planning within a single framework. While Deep Reinforcement Learning (DRL) has recently gained traction in this domain, existing approaches often overlook the "
1901.01920v1,Data is Personal: Attitudes and Perceptions of Data Visualization in Rural Pennsylvania,2019-01-07,3,cs.HC,"Many of the guidelines that inform how designers create data visualizations originate in studies that unintentionally exclude populations that are most likely to be among the 'data poor'. In this paper, we explore which factors may drive attention and trust in rural populations with diverse economic"
2501.05997v1,Minimizing Occlusion Effect on Multi-View Camera Perception in BEV with Multi-Sensor Fusion,2025-01-10,7,cs.CV,"Autonomous driving technology is rapidly evolving, offering the potential for safer and more efficient transportation. However, the performance of these systems can be significantly compromised by the occlusion on sensors due to environmental factors like dirt, dust, rain, and fog. These occlusions "
2103.16273v1,Multi-modal Trajectory Prediction for Autonomous Driving with Semantic Map and Dynamic Graph Attention Network,2021-03-30,7,cs.CV;cs.RO,"Predicting future trajectories of surrounding obstacles is a crucial task for autonomous driving cars to achieve a high degree of road safety. There are several challenges in trajectory prediction in real-world traffic scenarios, including obeying traffic rules, dealing with social interactions, han"
2011.08729v3,Control Strategies for Autonomous Vehicles,2020-11-17,3,cs.RO;eess.SY,"This chapter focuses on the self-driving technology from a control perspective and investigates the control strategies used in autonomous vehicles and advanced driver-assistance systems from both theoretical and practical viewpoints. First, we introduce the self-driving technology as a whole, includ"
2505.21581v4,CogAD: Cognitive-Hierarchy Guided End-to-End Autonomous Driving,2025-05-27,7,cs.RO;cs.CV,"While end-to-end autonomous driving has advanced significantly, prevailing methods remain fundamentally misaligned with human cognitive principles in both perception and planning. In this paper, we propose CogAD, a novel end-to-end autonomous driving model that emulates the hierarchical cognition me"
2408.16952v1,Transient Fault Tolerant Semantic Segmentation for Autonomous Driving,2024-08-30,6,cs.CV;cs.AI,"Deep learning models are crucial for autonomous vehicle perception, but their reliability is challenged by algorithmic limitations and hardware faults. We address the latter by examining fault-tolerance in semantic segmentation models. Using established hardware fault models, we evaluate existing ha"
2003.00601v1,3D Point Cloud Processing and Learning for Autonomous Driving,2020-03-01,5,cs.CV;eess.SP,"We present a review of 3D point cloud processing and learning for autonomous driving. As one of the most important sensors in autonomous vehicles, light detection and ranging (LiDAR) sensors collect 3D point clouds that precisely record the external surfaces of objects and scenes. The tools for 3D p"
1911.01054v2,SoildNet: Soiling Degradation Detection in Autonomous Driving,2019-11-04,1,cs.CV;cs.LG;cs.RO;eess.IV,"In the field of autonomous driving, camera sensors are extremely prone to soiling because they are located outside of the car and interact with environmental sources of soiling such as rain drops, snow, dust, sand, mud and so on. This can lead to either partial or complete vision degradation. Hence "
2509.23922v1,DriveE2E: Closed-Loop Benchmark for End-to-End Autonomous Driving through Real-to-Simulation,2025-09-28,7,cs.CV;cs.RO,"Closed-loop evaluation is increasingly critical for end-to-end autonomous driving. Current closed-loop benchmarks using the CARLA simulator rely on manually configured traffic scenarios, which can diverge from real-world conditions, limiting their ability to reflect actual driving performance. To ad"
2312.06351v1,Evaluation of Large Language Models for Decision Making in Autonomous Driving,2023-12-11,14,cs.CV;cs.CL;cs.RO,"Various methods have been proposed for utilizing Large Language Models (LLMs) in autonomous driving. One strategy of using LLMs for autonomous driving involves inputting surrounding objects as text prompts to the LLMs, along with their coordinate and velocity information, and then outputting the sub"
2001.03908v2,Self-Driving like a Human driver instead of a Robocar: Personalized comfortable driving experience for autonomous vehicles,2020-01-12,10,eess.SY;cs.RO,This paper issues an integrated control system of self-driving autonomous vehicles based on the personal driving preference to provide personalized comfortable driving experience to autonomous vehicle users. We propose an Occupant's Preference Metric (OPM) which is defining a preferred lateral and l
1909.06684v1,3D Kidneys and Kidney Tumor Semantic Segmentation using Boundary-Aware Networks,2019-09-14,2,eess.IV;cs.CV;cs.LG,"Automated segmentation of kidneys and kidney tumors is an important step in quantifying the tumor's morphometrical details to monitor the progression of the disease and accurately compare decisions regarding the kidney tumor treatment. Manual delineation techniques are often tedious, error-prone and"
2508.05065v2,Decoupling Continual Semantic Segmentation,2025-08-07,8,cs.CV,"Continual Semantic Segmentation (CSS) requires learning new classes without forgetting previously acquired knowledge, addressing the fundamental challenge of catastrophic forgetting in dense prediction tasks. However, existing CSS methods typically employ single-stage encoder-decoder architectures w"
2209.08575v1,SegNeXt: Rethinking Convolutional Attention Design for Semantic Segmentation,2022-09-18,6,cs.CV,"We present SegNeXt, a simple convolutional network architecture for semantic segmentation. Recent transformer-based models have dominated the field of semantic segmentation due to the efficiency of self-attention in encoding spatial information. In this paper, we show that convolutional attention is"
2602.23499v4,TaCarla: A comprehensive benchmarking dataset for end-to-end autonomous driving,2026-02-26,7,cs.RO;cs.AI,"Collecting a high-quality dataset is a critical task that demands meticulous attention to detail, as overlooking certain aspects can render the entire dataset unusable. Autonomous driving challenges remain a prominent area of research, requiring further exploration to enhance the perception and plan"
1905.07290v1,LiDAR Sensor modeling and Data augmentation with GANs for Autonomous driving,2019-05-17,4,cs.CV;cs.LG;cs.RO;eess.IV,"In the autonomous driving domain, data collection and annotation from real vehicles are expensive and sometimes unsafe. Simulators are often used for data augmentation, which requires realistic sensor models that are hard to formulate and model in closed forms. Instead, sensors models can be learned"
1806.09790v2,CFENet: An Accurate and Efficient Single-Shot Object Detector for Autonomous Driving,2018-06-26,5,cs.CV,"The ability to detect small objects and the speed of the object detector are very important for the application of autonomous driving, and in this paper, we propose an effective yet efficient one-stage detector, which gained the second place in the Road Object Detection competition of CVPR2018 works"
2206.11428v2,"LidarMultiNet: Unifying LiDAR Semantic Segmentation, 3D Object Detection, and Panoptic Segmentation in a Single Multi-task Network",2022-06-23,7,cs.CV,"This technical report presents the 1st place winning solution for the Waymo Open Dataset 3D semantic segmentation challenge 2022. Our network, termed LidarMultiNet, unifies the major LiDAR perception tasks such as 3D semantic segmentation, object detection, and panoptic segmentation in a single fram"
2104.10753v1,Multi-task Learning with Attention for End-to-end Autonomous Driving,2021-04-21,4,cs.RO;cs.AI;cs.CV,"Autonomous driving systems need to handle complex scenarios such as lane following, avoiding collisions, taking turns, and responding to traffic signals. In recent years, approaches based on end-to-end behavioral cloning have demonstrated remarkable performance in point-to-point navigational scenari"
2110.07067v2,Offline Reinforcement Learning for Autonomous Driving with Safety and Exploration Enhancement,2021-10-13,4,cs.RO;eess.SY,"Reinforcement learning (RL) is a powerful data-driven control method that has been largely explored in autonomous driving tasks. However, conventional RL approaches learn control policies through trial-and-error interactions with the environment and therefore may cause disastrous consequences such a"
2504.04338v1,Data Scaling Laws for End-to-End Autonomous Driving,2025-04-06,10,cs.RO;cs.CV;cs.LG,"Autonomous vehicle (AV) stacks have traditionally relied on decomposed approaches, with separate modules handling perception, prediction, and planning. However, this design introduces information loss during inter-module communication, increases computational overhead, and can lead to compounding er"
1911.04175v1,Multi-Agent Connected Autonomous Driving using Deep Reinforcement Learning,2019-11-11,1,cs.LG;cs.AI;cs.MA;cs.RO;stat.ML,The capability to learn and adapt to changes in the driving environment is crucial for developing autonomous driving systems that are scalable beyond geo-fenced operational design domains. Deep Reinforcement Learning (RL) provides a promising and scalable framework for developing adaptive learning b
2102.06191v3,Unsupervised Semantic Segmentation by Contrasting Object Mask Proposals,2021-02-11,4,cs.CV;cs.LG,"Being able to learn dense semantic representations of images without supervision is an important problem in computer vision. However, despite its significance, this problem remains rather unexplored, with a few exceptions that considered unsupervised semantic segmentation on small-scale datasets wit"
2106.13963v1,OffRoadTranSeg: Semi-Supervised Segmentation using Transformers on OffRoad environments,2021-06-26,3,cs.CV;cs.RO,"We present OffRoadTranSeg, the first end-to-end framework for semi-supervised segmentation in unstructured outdoor environment using transformers and automatic data selection for labelling. The offroad segmentation is a scene understanding approach that is widely used in autonomous driving. The popu"
2210.12852v3,1st Place Solution of The Robust Vision Challenge 2022 Semantic Segmentation Track,2022-10-23,6,cs.CV,This report describes the winning solution to the Robust Vision Challenge (RVC) semantic segmentation track at ECCV 2022. Our method adopts the FAN-B-Hybrid model as the encoder and uses SegFormer as the segmentation framework. The model is trained on a composite dataset consisting of images from 9 
2211.09445v3,aiMotive Dataset: A Multimodal Dataset for Robust Autonomous Driving with Long-Range Perception,2022-11-17,14,cs.CV,"Autonomous driving is a popular research area within the computer vision research community. Since autonomous vehicles are highly safety-critical, ensuring robustness is essential for real-world deployment. While several public multimodal datasets are accessible, they mainly comprise two sensor moda"
2109.15242v3,Transferability Estimation for Semantic Segmentation Task,2021-09-30,3,cs.CV,"Transferability estimation is a fundamental problem in transfer learning to predict how good the performance is when transferring a source model (or source task) to a target task. With the guidance of transferability score, we can efficiently select the highly transferable source models without perf"
1707.09465v5,Curriculum Domain Adaptation for Semantic Segmentation of Urban Scenes,2017-07-29,3,cs.CV;cs.LG,"During the last half decade, convolutional neural networks (CNNs) have triumphed over semantic segmentation, which is one of the core tasks in many applications such as autonomous driving. However, to train CNNs requires a considerable amount of data, which is difficult to collect and laborious to a"
2409.18053v3,DualAD: Dual-Layer Planning for Reasoning in Autonomous Driving,2024-09-26,3,cs.RO;cs.AI,"We present a novel autonomous driving framework, DualAD, designed to imitate human reasoning during driving. DualAD comprises two layers: a rule-based motion planner at the bottom layer that handles routine driving tasks requiring minimal reasoning, and an upper layer featuring a rule-based text enc"
2305.17181v1,Selective Communication for Cooperative Perception in End-to-End Autonomous Driving,2023-05-26,2,cs.RO;cs.CV,"The reliability of current autonomous driving systems is often jeopardized in situations when the vehicle's field-of-view is limited by nearby occluding objects. To mitigate this problem, vehicle-to-vehicle communication to share sensor information among multiple autonomous driving vehicles has been"
2011.14910v1,Trajformer: Trajectory Prediction with Local Self-Attentive Contexts for Autonomous Driving,2020-11-30,3,cs.CV,"Effective feature-extraction is critical to models' contextual understanding, particularly for applications to robotics and autonomous driving, such as multimodal trajectory prediction. However, state-of-the-art generative methods face limitations in representing the scene context, leading to predic"
1909.07541v1,A*3D Dataset: Towards Autonomous Driving in Challenging Environments,2019-09-17,9,cs.CV;cs.RO,"With the increasing global popularity of self-driving cars, there is an immediate need for challenging real-world datasets for benchmarking and training various computer vision tasks such as 3D object detection. Existing datasets either represent simple scenarios or provide only day-time data. In th"
2006.09738v1,LRPD: Long Range 3D Pedestrian Detection Leveraging Specific Strengths of LiDAR and RGB,2020-06-17,3,cs.CV,"While short range 3D pedestrian detection is sufficient for emergency breaking, long range detections are required for smooth breaking and gaining trust in autonomous vehicles. The current state-of-the-art on the KITTI benchmark performs suboptimal in detecting the position of pedestrians at long ra"
2212.00623v1,BEV-LGKD: A Unified LiDAR-Guided Knowledge Distillation Framework for BEV 3D Object Detection,2022-12-01,6,cs.CV,"Recently, Bird's-Eye-View (BEV) representation has gained increasing attention in multi-view 3D object detection, which has demonstrated promising applications in autonomous driving. Although multi-view camera systems can be deployed at low cost, the lack of depth information makes current approache"
2605.12220v1,TriBand-BEV: Real-Time LiDAR-Only 3D Pedestrian Detection via Height-Aware BEV and High-Resolution Feature Fusion,2026-05-12,2,cs.CV;cs.AI;cs.LG;cs.RO,"Safe autonomous agents and mobile robots need fast real time 3D perception, especially for vulnerable road users (VRUs) such as pedestrians. We introduce a new bird's eye view (BEV) encoding, which maps the full 3D LiDAR point cloud into a light-weight 2D BEV tensor with three height bands. We expli"
2203.14956v2,LiDAR Distillation: Bridging the Beam-Induced Domain Gap for 3D Object Detection,2022-03-28,6,cs.CV;cs.RO,"In this paper, we propose the LiDAR Distillation to bridge the domain gap induced by different LiDAR beams for 3D object detection. In many real-world applications, the LiDAR points used by mass-produced robots and vehicles usually have fewer beams than that in large-scale public datasets. Moreover,"
2203.08195v1,DeepFusion: Lidar-Camera Deep Fusion for Multi-Modal 3D Object Detection,2022-03-15,13,cs.CV,"Lidars and cameras are critical sensors that provide complementary information for 3D detection in autonomous driving. While prevalent multi-modal methods simply decorate raw lidar point clouds with camera features and feed them directly to existing 3D detection models, our study shows that fusing c"
2603.04938v1,Person Detection and Tracking from an Overhead Crane LiDAR,2026-03-05,3,cs.CV;cs.LG;cs.RO,"This paper investigates person detection and tracking in an industrial indoor workspace using a LiDAR mounted on an overhead crane. The overhead viewpoint introduces a strong domain shift from common vehicle-centric LiDAR benchmarks, and limited availability of suitable public training data. Hencefo"
2311.11971v2,LiDAR-HMR: 3D Human Mesh Recovery from LiDAR,2023-11-20,4,cs.CV,"In recent years, point cloud perception tasks have been garnering increasing attention. This paper presents the first attempt to estimate 3D human body mesh from sparse LiDAR point clouds. We found that the major challenge in estimating human pose and mesh from point clouds lies in the sparsity, noi"
